{
  "schema_version": "1.0",
  "manuscript_slug": "fixture-study",
  "run_id": "20260712T120000Z",
  "mode": "critique",
  "packet_path": "reviews/fixture-study/20260712T120000Z/packet.json",
  "reviewer_reports": [
    {"role": "domain", "path": "reviews/fixture-study/20260712T120000Z/reviewers/domain.json", "recommendation": "major_revision", "confidence": 0.8},
    {"role": "methods-statistics", "path": "reviews/fixture-study/20260712T120000Z/reviewers/methods-statistics.json", "recommendation": "major_revision", "confidence": 0.9},
    {"role": "skeptic", "path": "reviews/fixture-study/20260712T120000Z/reviewers/skeptic.json", "recommendation": "reject", "confidence": 0.7}
  ],
  "issues": [
    {"issue_id": "ISSUE-001", "source_roles": ["methods-statistics", "skeptic"], "severity": "major", "category": "controls", "location": "Methods, paragraph 3", "evidence": "No negative control is described.", "problem": "The main effect cannot be separated from contamination.", "required_action": "Add and report an appropriate negative control.", "status": "open"}
  ],
  "conflicts_path": "reviews/fixture-study/20260712T120000Z/conflicts.json",
  "editor_path": "reviews/fixture-study/20260712T120000Z/editor.json",
  "editor_recommendation": "major_revision"
}
